{"artifact":{"cid_profile":{"base":"base32","codec":"dag-cbor","hash":"sha2-256","name":"mcp.cidprofile.default","normalization":{"path_separator":"/","reject_symlinks":true,"sort_entries":true,"strip_owner":true,"strip_permissions":true,"strip_timestamps":true},"version":"1"},"media_type":"application/vnd.mcp.toolbundle+car","root_cid":"bafybeigdyrzt5sfp7udm7hu76uh7y26nf3efuylqabf3oclgtqy55fbzdi","size_bytes":1024},"entrypoint":{"runtime":"node","target":"dist/tool.js:handle"},"schema_version":"tool.descriptor.v0.1","schemas":{"request":[{"cid":"bafybeigdyrzt5sfp7udm7hu76uh7y26nf3efuylqabf3oclgtqy55fbzdi","name":"test.request.v0.1"}],"response":[{"cid":"bafybeigdyrzt5sfp7udm7hu76uh7y26nf3efuylqabf3oclgtqy55fbzdi","name":"test.response.v0.1"}]},"security":{"policy":{"exec":"deny","filesystem":"read_only","network":"deny"}},"tool":{"description":"Test fixture tool for CID computation vectors","display_name":"MCP Registry Fixture Tool","license":"MIT","name":"mcp.registry.fixture","version":"0.1.0"}}